EC,EC,1977,208,,,NEP,Sagarmatha Integrated Rural Development,EC,,E,,,330, ,, ,10/27/1977,,NEP,,,Multidonor,PP,E,PS,,3000,Agriculture and Natural Resources,3014,Agriculture and Rural Sector Development,,,,,,,,,,,,,
EC,EC,1977,215,,,BAN,Pabna Irrigation and Rural Development (Phase I),EC,,J,30,,220, ,, ,11/24/1977,,BAN,,,Multidonor,PP,J,PS,,3000,Agriculture and Natural Resources,3011,"Irrigation, Drainage, and Flood Protection",,,,,,,,,,,,,
EC,EC,1977,220,,,BAN,Rural Vocational Training Institutes,EC,,E,,,147, ,, ,12/13/1977,,BAN,,,Multidonor,PP,E,PS,,3100,Education,3105,Technical Education and Vocational Skills Training,,,,,,,,,,,,,
EC,EC,1978,0,,,INO,South East Sulawesi Transmigration and Area Development,EC,,E,,,2370, ,, ,12/22/1978,,INO,,,Multidonor,PP,E,PS,,,Multisector,,Multisector,,,,,,,,,,,,,
EC,EC,1978,273,,,NEP,Second Integrated Rural Development,EC,,E,,,350, ,, ,12/20/1978,,NEP,,,Multidonor,PP,E,PS,,3000,Agriculture and Natural Resources,3014,Agriculture and Rural Sector Development,,,,,,,,,,,,,
EC,EC,1979,276,,,SRI,Integrated Tea Development,EC,,E,,,98, ,, ,02/12/1979,,SRI,,,Multidonor,PP,E,PS,,3000,Agriculture and Natural Resources,3001,Agricultural Production and Markets,,,,,,,,,,,,,
EC,EC,1979,277,,,LAO,Agricultural Support Facilities,EC,,E,,,66, ,, ,02/13/1979,,LAO,,,Multidonor,PP,E,PS,,3000,Agriculture and Natural Resources,3001,Agricultural Production and Markets,,,,,,,,,,,,,
EC,EC,1979,285,,,BAN,Tubewell,EC,,E,,,315, ,, ,03/22/1979,,BAN,,,Multidonor,PP,E,PS,,3000,Agriculture and Natural Resources,3011,"Irrigation, Drainage, and Flood Protection",,,,,,,,,,,,,
EC,EC,1979,300,,,SRI,Anuradhapura Dry Zone Agriculture,EC,,E,,,300, ,, ,07/05/1979,,SRI,,,Multidonor,PP,E,PS,,3000,Agriculture and Natural Resources,3012,Land-Based Natural Resources Management,,,,,,,,,,,,,
EC,EC,1979,303,,,MYA,Post-Harvest Rice Technology Center,EC,,E,,,150, ,, ,08/30/1979,,MYA,,,Multidonor,AD,E,PS,,3000,Agriculture and Natural Resources,3001,Agricultural Production and Markets,,,,,,,,,,,,,
EC,EC,1979,326,,,PHI,Palawan Integrated Area Development,EC,,J,,,350, ,, ,12/17/1979,,PHI,,,Multidonor,PP,J,PS,,3000,Agriculture and Natural Resources,3014,Agriculture and Rural Sector Development,,,,,,,,,,,,,
EC,EC,1979,331,,,NEP,Second Livestock Development,EC,,E,,,170, ,, ,12/19/1979,,NEP,AWD,AWAR,Multidonor,PP,E,PS,,3000,Agriculture and Natural Resources,3006,Livestock,,,,,,,,,,,,,
EC,EC,1980,339,,,PAK,Agro-Technical Education,EC,,E,,,147, ,, ,02/28/1980,,PAK,IFD,IFED,Multidonor,PP,E,PS,,3100,Education,,,,,,,,,,,,,,,
EC,EC,1980,341,,,INO,Palm Oil Processing,EC,,E,,,98, ,, ,03/14/1980,,INO,,,Multidonor,PP,E,PS,,3000,Agriculture and Natural Resources,,,,,,,,,,,,,,,
EC,EC,1980,355,,,INO,Aceh and North Sumatra Livestock Development,EC,,E,,,170, ,, ,05/26/1980,,INO,,,Multidonor,PP,E,PS,,3000,Agriculture and Natural Resources,,,,,,,,,,,,,,,
EC,EC,1980,356,,,THA,Medium-Scale Irrigation Package,EC,,E,,,350, ,, ,06/10/1980,,THA,,,Multidonor,PP,E,PS,,3000,Agriculture and Natural Resources,,,,,,,,,,,,,,,
EC,EC,1981,400,,,THA,Agricultural Education,EC,,E,,,230, ,, ,04/22/1981,,THA,IFD,IFED,Multidonor,PP,E,PS,,3100,Education,,,,,,,,,,,,,,,
EC,EC,1982,475,,,PHI,Sorsogon Integrated Area,EC,,E,,,350, ,, ,08/19/1982,,PHI,ARDD,ARRD,Multidonor,PP,E,PS,,3000,Agriculture and Natural Resources,,,,,,,,,,,,,,,
EC,EC,1983,512,,,SRI,Walawe Irrigation Rehabilitation and Improvement,EC,,E,,,248, ,, ,05/09/1983,,SRI,,,Multidonor,PP,E,PS,,3000,Agriculture and Natural Resources,,,,,,,,,,,,,,,
EC,EC,1984,596,,,PAK,Left Bank Outfall Drain - Stage 1,EC,,E,,,250, ,, ,05/15/1984,,PAK,,,Multidonor,PP,E,PS,,3000,Agriculture and Natural Resources,,,,,,,,,,,,,,,
EC,EC,1984,625,,,MAL,Aquaculture Development,EC,,E,,,330, ,, ,09/04/1984,,MAL,,,Multidonor,PP,E,PS,,3000,Agriculture and Natural Resources,,,,,,,,,,,,,,,
EC,EC,1984,633,,,INO,Manpower Training,EC,,E,,,150, ,, ,10/18/1984,,INO,IFD,IFED,Multidonor,PP,E,PS,,3600,Public Sector Management,,,,,,,,,,,,,,,
EC,EC,1986,835,,,PAK,Tariff Study on WAPDA/KESC Integration,EC,,E,,,475, ,, ,12/18/1986,,PAK,IWD,IWEN,Multidonor,AD,E,PS,,3200,Energy,,,,,,,,,,,,,,,
EC,EC,2005,4391,,3747201,INO,Basic Education Sector Capacity Support Program (Supplementary),EC,,J,500,,6030, ,, ,10/19/2005,,INO,SERD,IRM,Multidonor,PA,J,PS,,3100,Education,3106,Education Sector Development,,Social Development,Governance,,,,,,,,Successful,,
EC,EC,2008,7178,,4026303,SOL,Establishment of the Solomon Islands Maritime Study Administration,EC,,J,1000,,600, ,, ,11/25/2008,,SOL,PARD,PAHQ,Multidonor,AD,J,PS,,3700,Transport and ICT,3702,Water Transport (Non-Urban),,Economic Growth,Private Sector Development,,,,,,,,Successful,,
EC,EC,2010,7554,,4327301,INO,Analytical and Capacity Development Partnership,EC,,J,,,27000,13 Jul 2010,,,06/15/2010,07/13/2010,INO,SERD,IRM,Multidonor,CD,J,PS,,3100,Education,3106,Education Sector Development,,Social Development,Capacity Development,,,Human Development,"Client Relations,Network,And Partnership Development",,,"DR 2010. para on Education, new project pp 37.  DR 2010. Case Study: Reforming Education, pp 39.",,,
EC,EC,2013,8173,,36172-063,NEP,Supporting the Strengthening Public Management Program (Supplementary),EC,,,,,2950, ,,,11/05/2013,,NEP,SARD,SAPF,Multidonor,CD,,PS,,3600,Public Sector Management,3604,Decentralization,,Governance,Capacity Development,,,Economic and Financial governance,Institutional Development,,,,,,
EC,EC,2013,8358,,47013-001,INO,Minimum Service Standards Capacity Development Program,EC,,E,,,47030, ,,,04/24/2013,,INO,SERD,IRM,Multidonor,CD,E,PS,,3100,Education,3106,Education Sector Development,,Social Development,Capacity Development,,,Human Development,"Client Relations,Network,And Partnership Development",,,,,,
EIB,EIB,2016,8345,,46500,REG,Establishment of the Pacific Region Infrastructure Facility Coordination Office (Supplementary),EIB,,J,1000,,1100,29 Feb 2016,,,02/29/2016,02/29/2016,REG,PARD,PLCO,Single Donor,PA,J,PS,,3200,Energy,,,,,,,,,,,,,,,
Finland,,1985,670,,,NEP,Master Plan for Forestry Development,FIN,,J,250,,1100,10 Apr 1985,,06 Nov 1985,02/20/1985,04/10/1985,NEP,AGDX,AGIF,Single Donor,AD,J,PS,,3000,Agriculture and Natural Resources,,,,,,,,,,,,,,,
Finland,,1988,993,,,PHI,Master Plan for Forestry Development,FIN,,E,395,,922,30 Oct 1987,,21 Nov 1988,06/28/1988,10/30/1987,PHI,,,Single Donor,AD,E,PS,,3000,Agriculture and Natural Resources,,,,,,,,,,,,,,,
Finland,,1989,993,,,PHI,Master Plan for Forestry Development ,FIN,,E,,,374,21 Nov 1988,,21 Nov 1988,12/05/1989,11/21/1988,PHI,,,Single Donor,AD,E,PS,,3000,Agriculture and Natural Resources,,,,,,,,,,,,,,,
Finland,,1989,1120,,,NEP,Implementation of the Master Plan for the Forestry Sector,FIN,,J,350,,374,30 Oct 1989,,30 Oct 1989,02/06/1989,10/30/1989,NEP,AGD,AG4,Single Donor,AD,J,PS,,3000,Agriculture and Natural Resources,,,,,,,,,,,,,,,
Finland,,1989,5339,,,REG,Economic Policies for Sustainable Dev: Implementing the Brundtland Commission Recommendations in Selected DMCs,FIN,,J,600,,200,27 Jan 1989,,07 Sep 1989,05/12/1989,01/27/1989,REG,OESD,ENVD,Single Donor,RE,J,PS,,3600,Public Sector Management,3603,Economic and Public Affairs Management,,,,,,,,,,,,,
Finland,,1990,1318,,,BAN,Dhaka Integrated Flood Protection,FIN,,J,250,,350,29 Mar 1990,,19 Jan 1990,06/07/1990,03/29/1990,BAN,IFD,IFWW,Single Donor,PP,J,C,,3000,Agriculture and Natural Resources,,,,,,,,,,,,,,,
Finland,,1991,993,,,PHI,Master Plan for Forestry Development - Extension Phase,FIN,,E,,,1237,18 Oct 1991,,17 Dec 1991,01/09/1991,10/18/1991,PHI,RMU,AEFN,Single Donor,AD,E,PS,,3000,Agriculture and Natural Resources,,,,,,,,,,,,,,,
Finland,,1991,1584,,,SRI,Second Water Supply Sector,FIN,,E,,,250,29 Mar 1990,,19 Jan 1990,10/25/1991,03/29/1990,SRI,AWD,AWWU,Single Donor,PP,E,C,,3800,Water and Other Municipal Infrastructure and Services,,,,,,,,,,,,,,,
Finland,,1992,1737,,,NEP,"Kali Gandaki ""A"" Hydroelectric",FIN,,J,,,1000,01 Dec 1992,,13 Jan 1993,07/28/1992,12/01/1992,NEP,IWD,IWEN,Single Donor,PP,J,PS,,3200,Energy,,,,,,,,,,,,,,,
Finland,,1994,5591,,2801601,REG,A Study of the Status of Forestry and Forest Industries in the Asian and Pacific Region,FIN,,J,120,,75,13 May 1994,,15 Dec 1994,08/05/1994,05/13/1994,REG,,,Single Donor,RE,J,PS,,3000,Agriculture and Natural Resources,3004,Forestry,,,,,,,,,,,,,
Finland,,1996,5684,,2836001,REG,Subregional Environmental Training and Institutional Strengthening in the Greater Mekong Subregion,FIN,,J,800,,100,03 Nov 1994,,03 Dec 1996,05/09/1996,11/03/1994,REG,SDCC,SDES,Single Donor,RE,J,PS,,3000,Agriculture and Natural Resources,3013,Water-Based Natural Resources Management,,,,,,,,,,,GS,,
Finland,,1997,5591,,,REG,A Study of the Status of Forestry and Forest Industries in the Asian and Pacific Region,FIN,,E,,,19.8,20 Dec 1996,, ,03/03/1997,12/20/1996,REG,OESD,OEOC,Single Donor,RE,E,PS,,3000,Agriculture and Natural Resources,3004,Forestry,,,,,,,,,,,,,
Finland,,1998,5822,,3202101,REG,Protection and Management of Critical Wetlands in the Lower Mekong Basin,FIN,,J,1000,,650,03 Jul 1998,,25 Feb 1999,12/22/1998,07/03/1998,REG,SERD,SEAE,Single Donor,RE,J,PS,,3000,Agriculture and Natural Resources,3013,Water-Based Natural Resources Management,,,,,,,,,,,PS,,
Finland,,1999,5564,,n/a,REG,Regional Initiatives on Social Development and Women in Development,FIN,,E,,,50,15 Feb 1999,,24 Feb 1999,01/05/1999,02/15/1999,REG,OESD,SOCD,Single Donor,RE,E,PS,,3600,Public Sector Management,3603,Economic and Public Affairs Management,,,,,,,,,,,GS,,
Finland,,2002,3997,,3617601,CAM,Chong Kneas Environmental Improvement Project,FIN,,E,,,997,13 Jul 2010,,13 Nov 2002,11/22/2002,07/13/2010,CAM,SERD,SEAE,Single Donor,PP,E,PS,,3000,Agriculture and Natural Resources,3014,Agriculture and Rural Sector Development,,,,,,,,,,,,,
Finland,,2003,4197,,3660801,CAM,Tonle Sap Sustainable Livelihoods Project,FIN,,J,700,,560,29 Oct 2003,,29 Oct 2003,10/16/2003,10/29/2003,CAM,SERD,SEAE,Single Donor,PP,J,PS,,3000,Agriculture and Natural Resources,3013,Water-Based Natural Resources Management,,,,,,,,,,,,,
Finland,,2004,3997,,3617601,CAM,Chong Kneas Environmental Improvement Project,FIN,,E,,,113, ,, ,06/17/2004,,CAM,SERD,SEAE,Single Donor,PP,E,PS,,3000,Agriculture and Natural Resources,3014,Agriculture and Rural Sector Development,,,,,,,,,,,S,,
Finland,,2005,4669,,3757601,CAM,Study of the Influence of Built Structures in the Fisheriesof the Tonle Sap,FIN,,E,,,765, ,, ,10/13/2005,,CAM,SERD,SEAE,Single Donor,AD,E,PS,,3000,Agriculture and Natural Resources,3003,Fishery,,Economic Growth,Environmental Sustainability,,,Developing rural areas,"Natural Resources Conservation,Environmental Policy And Legislation",,,,S,,
Finland,,2007,6438,,41138-012,REG,Implementation of the Technical Support Facility under the CMI,FIN,,J,,,1015, ,, ,12/18/2007,,REG,SDCC,SDAS,Single Donor,R-RD,J,PS,,3200,Energy,3214,Energy Efficiency and Conservation,,Economic Growth,Environmental Sustainability,,,,,,,,Highly Successful,,
Finland,,2008,6289,,,REG,Core Environment Program and Biodiversity Conservation Corridors Initiative in the GMS,FIN,,J,400,,4900, ,,,02/11/2008,,REG,SERD,SEAE,Single Donor,RE,J,PS,,3000,Agriculture and Natural Resources,3012,Land-Based Natural Resources Management,,Economic Growth,Environmental Sustainability,Regional Cooperation and Integration,,,"Natural Resources Conservation,Global And Regional Transboundary Environmental Issues,Environmental Policy And Legislation",,,,,,
Finland,,2009,6438,,41138-012,REG,Implementation of the Technical Support Facility under the Carbon Market Initiative (Supplementary 1),FIN,,J,,,1000,26 May 2009,,,06/19/2009,05/26/2009,REG,SDCC,SDAS,Single Donor,R-RD,J,PS,,3200,Energy,3214,Energy Efficiency and Conservation,,Capacity Development,Economic growth,Environmental Sustainability,,,,,,,Highly Successful,,
Finland,,2011,7987,,4432301,REG,"Core Environment Program and Biodiversity Conservation Corridors Initiative in the Greater Mekong Subregion, Phase 2",FIN,,J,800,,14000, ,,,12/12/2011,,REG,SERD,SEER,Single Donor,R-CD,J,PS,,3000,Agriculture and Natural Resources,3012,Land-Based Natural Resources Management,,Environmental Sustainability,,,,"Natural Resources Conservation,Environmental Policy And Legislation",,,,,,,
Finland,,2012,6438,,41138-012,REG,Implementation of the Technical Support Facility under the Carbon Market Initiative (5th Supplementary),FIN,,J,,,587.25,12 Jan 2012,,,06/08/2012,01/12/2012,REG,SDCC,SDAS,Single Donor,R-RD,J,PS,,3200,Energy,3214,Energy Efficiency and Conservation,,,,,,,,,,,Highly Successful,,
Finland,,2013,8503,,47211-001,REG,Partnership for Innovation in Education in Asia and the Pacific,FIN,,J,400,,1300, ,,,11/11/2013,,REG,SDCC,SDGG,Single Donor,R-PA,J,PS,,3100,Education,3106,Education Sector Development,,Social Development,Gender Equity,Capacity Development,,Human Development,Gender Equity In (Human) Capabilities,"Client Relations,Network,And Partnership Development",,,,,
Finland,,2015,9062,,49270-001,REG,Supporting Low-Carbon Development in Asia and the Pacific through Carbon Markets,FIN,,J,,,1432.06,04 Sep 2015,,,12/18/2015,09/04/2015,REG,SDCC,SDCD,Single Donor,CD,J,PS,,3900,Multisector,3900,Multisector,,,,,,,,,,,,,
Foreign Commonwealth Office - UKG,Foreign Commonwealth Office - UKG,2012,7645,,44158-092,REG,Enabling Climate Change Responses in Asia and the Pacific - Strengthening Planning Capacity for Low Carbon Growth in Developing Asia (Subproject 4) (Supplementary),Foreign Commonwealth Office - UKG,,,,,135.02,25 Jul 2012,,,08/24/2012,07/25/2012,REG,ERD,EREA,Single Donor,R-RD,,PS,,3900,Multisector,3900,Multisector,,Economic Growth,Environmental Sustainability,,,,,,,,,,
FRA-AFD GMS Fund,FRA-AFD GMS Fund,2006,4848,,38558-012,CAM,Water Resources Mgt (Sector) Project,FRA-AFD GMS Fund,,E,1000,,300, ,, ,10/16/2006,,CAM,SERD,SEAE,Single Donor,PP,E,C,,3000,Agriculture and Natural Resources,3013,Water-Based Natural Resources Management,,Economic Growth,Environmental Sustainability,Governance,,,,,,,,,
FRA-AFD GMS Fund,FRA-AFD GMS Fund,2007,4966,,4020801,VIE,Capacity Bldg on Environmental Mgt of the Power Sector,FRA-AFD GMS Fund,,E,,,600, ,, ,09/10/2007,,VIE,SERD,SEEW,Single Donor,AD,E,C,,3200,Energy,3215,Energy Sector Development,,Environmental Sustainability,,,,,,,,,,,
FRA-AFD GMS Fund,FRA-AFD GMS Fund,2007,7018,,4167201,VIE,Strengthening Operations & Business Processes in Viet Nam Railways,FRA-AFD GMS Fund,,E,,,980, ,, ,12/12/2007,,VIE,SERD,SETU,Single Donor,AD,E,C,,3700,Transport and ICT,3703,Rail Transport,,Economic Growth,Regional Cooperation and Integration,,,,,,,"DR 2011. para on FRA-AFD GMS Fund, pp 35.",Successful,,
FRA-AFD GMS Fund,FRA-AFD GMS Fund,2007,7024,,4107701,VIE,Supporting the Energy Efficiency Program Implementation Project,FRA-AFD GMS Fund,,J,,,500, ,, ,12/12/2007,,VIE,SERD,SEEW,Single Donor,AD,J,C,,3200,Energy,3214,Energy Efficiency and Conservation,,Economic Growth,Environmental Sustainability,,,,,,,"DR 2012. para for Coop Fund for GMS, pp56.",Partly Successful,,
FRA-AFD GMS Fund,FRA-AFD GMS Fund,2013,8376,,41340-014,UZB,Advanced Electricity Metering Project Phase 2,FRA-AFD GMS Fund,,J,500,,250,29 Apr 2013,,,06/05/2013,04/29/2013,UZB,CWRD,CWEN,Single Donor,PP,J,C,,3200,Energy,3211,Electricity Transmission and Distribution,,Economic Growth,,,,Promoting Economic Efficiency and Enabling Business environment,,,,,,,
FRA-AFD GMS Fund,FRA-AFD GMS Fund,2013,8472,,47127-001,MYA,Mandalay City Urban Services Improvement,FRA-AFD GMS Fund,,J,1000,,500, ,,,10/03/2013,,MYA,SERD,SEUW,Single Donor,PP,J,C,,3800,Water and Other Municipal Infrastructure and Services,3813,Urban Sector Development,,Environmental Sustainability,Economic Growth,Capacity Development,,Urban Environmental Improvement,Promoting Economic Efficiency and Enabling Business environment,Institutional Development,,,,,
FRA-AFD GMS Fund,FRA-AFD GMS Fund,2015,8472,,47127-001,MYA,Mandalay City Urban Services Improvement (Supplementary),FRA-AFD GMS Fund,,J,,,300, ,,,08/17/2015,,MYA,SERD,SEUW,Single Donor,PP,J,C,,3800,Water and Other Municipal Infrastructure and Services,3813,"Urban Policy, Institutional and Capacity Development",,Environmental Sustainability,Economic Growth,Capacity Development,,Urban Environmental Improvement,Promoting Economic Efficiency and Enabling Business environment,Institutional Development,,,,,
FRA-AFD GMS Fund,FRA-AFD GMS Fund,2015,8982,,48158-001,CAM,Provincial Water Supply and Sanitation,FRA-AFD GMS Fund,,J,200,,500,12 Oct 2015,,,10/28/2015,10/12/2015,CAM,SERD,SEUW,Single Donor,PP,J,C,,3800,Water and Other Urban Infrastructure and Services,"3813,3814,3817","Urban Policy, Institutional and Capacity Development,Urban Water Supply,Urban Sanitation",,,,,,,,,,,,,
France,,1990,1289,,,LAO,Preparation of an Education Project,FRA,,E,,,300,13 Feb 1990,,02 May 1989,04/11/1990,02/13/1990,LAO,IFD,IFED,Single Donor,PP,E,C,,3100,Education,,,,,,,,,,,,,,,
France,,1990,1292,,,THA,A Volunteer Prog. for Natural Resources & Environmental Conservation,FRA,,J,598,,214,30 Mar 1990,,02 May 1989,04/23/1990,03/30/1990,THA,IFD,IFOD,Single Donor,AD,J,C,,3000,Agriculture and Natural Resources,,,,,,,,,,,,,,,
France,,1990,1325,,,IND,Vadodara-Bombay Expressway,FRA,,E,,,600,08 Dec 1989,,02 May 1989,06/15/1990,12/08/1989,IND,IFD,IFTW,Single Donor,PP,E,C,,3700,Transport and ICT,,,,,,,,,,,,,,,
France,,1990,1349,,,PAK,Urban Water Supply and Sanitation,FRA,,E,,,635,09 Nov 1989,,02 May 1989,08/08/1990,11/09/1989,PAK,AWD,AWWU,Single Donor,PP,E,C,,3800,Water and Other Municipal Infrastructure and Services,,,,,,,,,,,,,,,
France,,1990,5367,,,REG,Southern Thai-Lao Mekong Bridge,FRA,,E,40,,550,24 Jan 1990,,02 May 1989,02/27/1990,01/24/1990,REG,IFD,IFTW,Single Donor,RE,E,C,,3700,Transport and ICT,3704,Air Transport,,,,,,,,,,,,,
France,,1991,797,,,LAO,Implementation of Second Road Improvement ,FRA,,E,,,250,31 Oct 1990,,02 May 1989,03/08/1991,10/31/1990,LAO,,,Single Donor,AD,E,C,,3700,Transport and ICT,,,,,,,,,,,,,,,
France,,1991,1513,,n/a,PHI,Manila North-East Water Supply,FRA,,E,,,1283,17 Dec 1990,,02 May 1989,05/07/1991,12/17/1990,PHI,IFD,IFWE,Single Donor,PP,E,C,,3800,Water and Other Municipal Infrastructure and Services,,,,,,,,,,,,,,,
France,,1991,1574,,,MAL,Energy Conservation Study,FRA,,E,,,400,03 Jul 1991,,02 May 1989,10/10/1991,07/03/1991,MAL,ORM,RMCM,Single Donor,AD,E,C,,3200,Energy,,,,,,,,,,,,,,,
France,,1991,1603,,,MAL,Rehabilitation and Upgrading of Water Supply Systems,FRA,,E,,,597,17 Oct 1989,,02 May 1989,11/18/1991,10/17/1989,MAL,RMU,AEWU,Single Donor,PP,E,C,,3800,Water and Other Municipal Infrastructure and Services,,,,,,,,,,,,,,,
France,,1991,1619,,,PAK,"Environmental, Safety & Efficiency Improvements of SSGC's Operations",FRA,,E,,,680,21 Aug 1991,,02 May 1989,12/03/1991,08/21/1991,PAK,IWD,IWEN,Single Donor,AD,E,C,,3200,Energy,,,,,,,,,,,,,,,
France,,1991,1628,,,PRC,Energy-cum-Electricity Demand and Supply Analysis,FRA,,E,,,600,03 Jul 1991,,02 May 1989,12/16/1991,07/03/1991,PRC,ORM,RMCM,Single Donor,AD,E,C,,3200,Energy,,,,,,,,,,,,,,,
France,,1992,1713,,,INO,Institutional Support to Water Supply Enterprises,FRA,,E,,,600,30 May 1990,,02 May 1989,06/15/1992,05/30/1990,INO,RMU,AEWU,Single Donor,AD,E,C,,3800,Water and Other Municipal Infrastructure and Services,,,,,,,,,,,,,,,
France,,1993,1513,,n/a,PHI,Manila North-East Water Supply ,FRA,,E,,,48,18 May 1993,,02 May 1989,07/23/1993,05/18/1993,PHI,,,Single Donor,PP,E,C,,3800,Water and Other Municipal Infrastructure and Services,,,,,,,,,,,,,,,
France,,1993,1958,,n/a,MAL,Urban Transport Planning,FRA,,E,,,600,10 Sep 1992,,02 May 1989,09/29/1993,09/10/1992,MAL,ORM,IETC,Single Donor,AD,E,C,,3700,Transport and ICT,,,,,,,,,,,,,,,
France,,1993,1962,,n/a,BAN,Preparation of Power System Masterplan,FRA,,E,,,600,17 Sep 1990,,02 May 1989,10/11/1993,09/17/1990,BAN,IWD,IWEN,Single Donor,AD,E,C,,3200,Energy,,,,,,,,,,,,,,,
France,,1994,2212,,2641101,PRC,Beijing Urban Transport,FRA,,E,,,715,03 Oct 1994,,02 May 1989,11/28/1994,10/03/1994,PRC,ORM,IETC,Single Donor,AD,E,C,,3700,Transport and ICT,,,,,,,,,,,,,,,
France,,1994,5586,,2824901,REG,Study of the Lao-Thailand-Viet Nam East-West Transport Corridor,FRA,,E,,,1000,28 Jan 1994,,02 May 1989,07/18/1994,01/28/1994,REG,IWD,IWTC,Single Donor,RE,E,C,,3700,Transport and ICT,3712,Transport Management and Policies,,,,,,,,,,,,,
France,,1995,2292,,2642901,THA,Nongkai-Udonthani Water Supply and Sanitation,FRA,,E,,,600,01 May 1993,,02 May 1989,01/23/1995,05/01/1993,THA,AWD,AWWU,Single Donor,PP,E,C,,3800,Water and Other Municipal Infrastructure and Services,,,,,,,,,,,,,,,
France,,1995,2403,,2905901,IND,Energy and Environmental Management of the Industrial Development Bank of India,FRA,,E,0,,585, ,, ,09/26/1995,,IND,OCRP,INRM1,Single Donor,AD,E,C,,3500,Industry and Trade,,,,,,,,,,,,,,,
France,,1995,2487,,2922601,PHI,Preparation of a National Transport Strategy,FRA,,E,,,1000,17 May 1995,,02 May 1989,12/19/1995,05/17/1995,PHI,ORM,IETC,Single Donor,AD,E,C,,3700,Transport and ICT,,,,,,,,,,,,,,,
France,,1996,2594,,2967701,PAK,Natural Gas Import Study,FRA,,E,,,600,05 Jul 1996,,02 May 1989,06/26/1996,07/05/1996,PAK,IWD,IWEN,Single Donor,AD,E,C,,3200,Energy,,,,,,,,,,,,,,,
France,,1996,2629,,2819101,CAM,Power Rehabilitation II,FRA,,E,,,450,05 Jul 1996,,02 May 1989,08/20/1996,07/05/1996,CAM,IWD,IWEN,Single Donor,PP,E,C,,3200,Energy,,,,,,,,,,,,,,,
France,,1996,2642,,2928501,LAO,Restructuring and Consolidation of the State-Owned Commercial Banks (SCBs),FRA,,C,,,954,05 Jul 1996,,02 May 1989,09/12/1996,07/05/1996,LAO,IWD,IWFI,Single Donor,AD,C,C,,3300,Finance,,,,,,,,,,,,,,,
France,,1996,5697,,3000301,REG,Se Kong-Se San and Nam Theun River Basins  Hydropower Development Study,FRA,,E,500,,2000,06 Oct 1995,,02 May 1989,08/22/1996,10/06/1995,REG,IWD,IWEN,Single Donor,RE,E,C,,3200,Energy,3202,Large Hydropower,,,,,,,,,,,GS,,
France,,1997,2839,,2829401,INO,Reproductive Health Care,FRA,,E,,,500,25 Jul 1997,, ,08/11/1997,07/25/1997,INO,RMU,AEEH,Single Donor,PP,E,C,,3400,Health and Social Protection,,,,,,,,,,,,,,,
France,,1997,2938,,2835101,PRC,China National Automated Payments Systems,FRA,,J,250,,500,25 Jul 1997,,02 May 1989,12/15/1997,07/25/1997,PRC,ORM,RMCA,Single Donor,PP,J,C,,3300,Finance,,,,,,,,,,,,,,,
France,,1997,5738,,3119801,REG,East Loop Telecommunication Project in the Greater Mekong Subregion,FRA,,E,,,770,22 Nov 1996,,02 May 1989,05/28/1997,11/22/1996,REG,MKRD,MKID,Single Donor,RE,E,C,,3700,Transport and ICT,3706,ICT,,,,,,,,,,,GS,,
France,,1998,3026,,2941501,PRC,Strengthening Risk Management of the Agricultural Bank of China,FRA,,J,1000,,800,20 May 1998,,02 May 1989,06/04/1998,05/20/1998,PRC,ECRD,ECAE,Single Donor,AD,J,C,,3300,Finance,,,,,,,,,,,,,,,
France,,1999,3323,,2831501,VIE,Third Provincial Towns Water Supply and Sanitation,FRA,,J,100,,900, ,, ,12/03/1999,,VIE,MKRD,MKSS,Single Donor,PP,J,C,,3800,Water and Other Municipal Infrastructure and Services,,,,,,,,,,,,,,,
France,,2001,3638,,,PRC,Wuhan Wastewater Treatment,FRA,,E,,,500,14 Dec 1994,,14 Dec 1994,03/19/2001,12/14/1994,PRC,ECRD,ECSS,Single Donor,PP,E,C,,3800,Water and Other Municipal Infrastructure and Services,3802,Waste Management,,,,,,,,,,,,,
France,,2001,3763,,3434301,VIE,Road Map for Power Sector Reform,FRA,,E,,,400,14 Dec 1994,,14 Dec 1994,11/06/2001,12/14/1994,VIE,MKRD,MKID,Single Donor,AD,E,C,,3200,Energy,3215,Energy Sector Development,,,,,,,,,,,S,,
France,,2001,3769,,3543901,CAM,Capacity Building for Banking and Financial Management,FRA,,E,,,1000,14 Dec 1994,,14 Dec 1994,11/13/2001,12/14/1994,CAM,SERD,SEGF,Single Donor,AD,E,C,,3300,Finance,3315,Finance Sector Development,,,,,,,,,,,PS,,
France,,2001,3782,,3340201,INO,Reform of Water Enterprises,FRA,,E,,,600,14 Dec 1994,,14 Dec 1994,11/29/2001,12/14/1994,INO,SERD,SESS,Single Donor,AD,E,C,,3800,Water and Other Municipal Infrastructure and Services,3801,Water Supply and Sanitation,,,,,,,,,,,S,,
France,,2001,3810,,3513001,INO,Rural Microfinance,FRA,,E,,,1000,14 Dec 1994,,14 Dec 1994,12/18/2001,12/14/1994,INO,SERD,SEAE,Single Donor,PP,E,C,,3300,Finance,3304,Microfinance,,,,,,,,,,,S,,
France,,2002,3638,,3447201,PRC,Wuhan Wastewater Treatment ,FRA,,E,,,199,19 Feb 2002,,19 Feb 2002,03/01/2002,02/19/2002,PRC,ECRD,ECSS,Single Donor,PP,E,C,,3800,Water and Other Municipal Infrastructure and Services,3802,Waste Management,,,,,,,,,,,,,
France,,2002,3886,,3534302,VIE,Implem of the Public Administration Reform Program,FRA,,J,218,,34, ,, ,06/21/2002,,VIE,MKRD,VRM,Single Donor,PP,J,PS,,3600,Public Sector Management,3601,Public Administration,,,,,,,,,,,,,
France,,2003,4081,,3534303,VIE,Institutional and Capacity Building Support to the Ministry of Home Affairs,FRA,,J,770,,150,01 Aug 2003,, ,01/16/2003,08/01/2003,VIE,SERD,VRM,Single Donor,AD,J,PS,,3600,Public Sector Management,3601,Public Administration,,,,,,,,,,,S,,
France,,2005,4625,,3635201,VIE,Song Bung 4 Hydropower Project Phase II,FRA,,J,,,600, ,, ,08/02/2005,,VIE,SERD,SEEW,Single Donor,PP,J,C,,3200,Energy,3202,Large Hydropower,,Economic Growth,Social Development,Environmental Sustainability,,Widening Access To Markets and Economic Opportunities,"Indigenous Peoples,Involuntary Resettlement",Environmental Policy And Legislation,,,,,
France,,2005,4645,,,CAM,Restructuring of the Railways in Cambodia,FRA,,E,,,1500, ,, ,09/14/2005,,CAM,SERD,SETU,Single Donor,AD,E,C,,3700,Transport and ICT,3703,Rail Transport,,"Economic growth,Economic Growth",Private Sector Development,Governance,,Promoting Economic Efficiency and Enabling Business environment,Public Private Partnerships,"Public Administration (National,Decentralized,Regional)",,"DR 2011. para on FRA CFA, pp 42.",,,
France,,2005,6237,,,REG,GMS Phnom Penh Plan for Devt. Mgt. II,FRA,,J,,,1613, ,, ,08/01/2005,,REG,SERD,SESS,Single Donor,RE,J,PS,,3900,Multisector,3900,Multisector,,Regional Cooperation and Integration,Governance,Capacity Development,,,"Public Administration (National,Decentralized,Regional)","Institutional Development,Organizational Development,Client Relations,Network,And Partnership Development",,,Successful,,
