PRF,PRF,2004,4461,,3804401,AFG,Poverty Reduction and Rural Renewable Energy Development,PRF,,E,,,750, ,, ,12/03/2004,,AFG,SARD,SAOC,Multidonor,AD,E,C,,3200,Energy,3203,Renewable Energy,,,,,,,,,,,PS,,
PRF,PRF,2004,4480,,3856101,VIE,Developing Agricultural Insurance,PRF,,E,,,600, ,, ,12/15/2004,,VIE,SERD,SEGF,Multidonor,AD,E,C,,3000,Agriculture and Natural Resources,3014,Agriculture and Rural Sector Development,,,,,,,,,,,S,,
PRF,PRF,2004,4537,,3857601,PAK,Implementing Public Safety Reforms in Four Districts of the Province of Punjab,PRF,,E,,,950, ,, ,12/23/2004,,PAK,CWRD,PRM,Multidonor,AD,E,C,,3600,Public Sector Management,3605,Law and Judiciary,,,,,,,,,,,S,,
PRF,PRF,2004,4541,,3803901,AFG,Natural Resources Management and Poverty Reduction,PRF,,J,,,810, ,, ,12/23/2004,,AFG,SARD,SAOC,Multidonor,AD,J,C,,3000,Agriculture and Natural Resources,3012,Land-Based Natural Resources Management,,,,,,,,,,,PS,,
PRF,PRF,2004,6088,,3663301,REG,Strengthening and Collection of Purchasing Power Parity Data in Selected DMCs,PRF,,E,,,800, ,, ,10/14/2004,,REG,ERD,ERDI,Multidonor,RE,E,C,,3600,Public Sector Management,3603,Economic and Public Affairs Management,,,,,,,,,,,S,,
PRF,PRF,2004,6109,,3711601,REG,NGO Partnership for Poverty Reduction,PRF,,E,,,500,31 Dec 2004,, ,06/21/2004,12/31/2004,REG,SDCC,NGOC,Multidonor,RE,E,C,,3600,Public Sector Management,3603,Economic and Public Affairs Management,,,,,,,,,,,S,,
PRF,PRF,2004,6170,,3729601,REG,Pilot Project on Institutionalizing Civil Society Participation to Create Local Pro-Poor Budgets,PRF,,E,,,400, ,, ,04/06/2004,,REG,SDCC,RSCG,Multidonor,RE,E,C,,3600,Public Sector Management,3602,Public Expenditure and Fiscal Management,,,,,,,,,,,HS,,
PRF,PRF,2004,6175,,3767001,REG,Making Resource Allocation Pro-Poor and Participatory in the Pacific,PRF,,E,,,500, ,, ,06/16/2004,,REG,PARD,PAHQ,Multidonor,RE,E,C,,3600,Public Sector Management,3602,Public Expenditure and Fiscal Management,,,,,,,,,,,PS,,
PRF,PRF,2004,6176,,3774801,REG,Building Capacity for Participatory Approaches to Poverty Reductionin ADB Operations,PRF,,J,,,300, ,, ,07/14/2004,,REG,SDCC,SDGG,Multidonor,RE,J,C,,3600,Public Sector Management,3603,Economic and Public Affairs Management,,,,,,,,,,,PS,,
PRF,PRF,2004,6188,,3808601,REG,Establishing Legal Identity for Social Inclusion,PRF,,J,575,,575, ,, ,09/30/2004,,REG,OGC,OGC,Multidonor,RE,J,C,,3600,Public Sector Management,3605,Law and Judiciary,,,,,,,,,,,HS,,
PRF,PRF,2004,6190,,3766701,REG,Preventing the Trafficking of Women and Children and PromotingSafe Migration in the GMS,PRF,,E,,,700, ,, ,10/04/2004,,REG,SERD,SEAE,Multidonor,RE,E,C,,3400,Health and Social Protection,3405,Social Protection,,,,,,,,,,,S,,
PRF,PRF,2004,6224,,3808201,REG,Pilot Testing Participatory Assessment Methodologies for Sustainableand Equitable Water Supply and Sanitation Services,PRF,,E,,,550, ,, ,12/23/2004,,REG,SDCC,SDGG,Multidonor,RE,E,C,,3800,Water and Other Municipal Infrastructure and Services,3801,Water Supply and Sanitation,,,,,,,,,,,S,,
PRF,PRF,2005,4283,,3725001,CAM,Participatory Poverty Assessment of the Tonle Sap ,PRF,,E,,,100, ,, ,09/13/2005,,CAM,SERD,SEAE,Multidonor,AD,E,C,,3600,Public Sector Management,3603,Economic and Public Affairs Management,,Social Development,,,,,,,,,HS,,
PRF,PRF,2005,4331,,3765401,VIE,Support for Pro-Poor Health Policies,PRF,,E,,,50, ,, ,10/31/2005,,VIE,SERD,SESS,Multidonor,AD,E,C,,3400,Health and Social Protection,3413,Health Systems,,Social Development,,,,,,,,,HS,,
PRF,PRF,2005,4434,,,LAO,"Poverty Reduction through Land Tenure Consolidation, Participatory Natural Resources Management and Local Communities Skills Building",PRF,,E,,,124.3, ,, ,03/02/2005,,LAO,SERD,SEAE,Multidonor,AD,E,C,,3000,Agriculture and Natural Resources,3012,Land-Based Natural Resources Management,,Social Development,Environmental Sustainability,Gender Equity,,,,,,,PS,,
PRF,PRF,2005,4566,,3761601,PRC,Poverty Reduction in Coal Mine Areas in Shanxi Province,PRF,,E,,,500, ,, ,02/15/2005,,PRC,EARD,EAEN,Multidonor,AD,E,C,,3200,Energy,3215,Energy Sector Development,,Social Development,,,,,,,,,S,,
PRF,PRF,2005,4567,,3908201,SRI,Sri Lanka Post-Tsunami Needs Assessment Prep for Emergency AssistanceImplementation Strategies,PRF,,E,,,500, ,, ,02/18/2005,,SRI,SARD,SLRM,Multidonor,PP,E,C,,3900,Multisector,3900,Multisector,,Social Development,,,,Human Development,,,,,S,,
PRF,PRF,2005,4574,,3729001,CAM,Community Self-Reliance and Flood Risk Reduction,PRF,,E,,,500, ,, ,04/08/2005,,CAM,SERD,SEAE,Multidonor,AD,E,C,,3000,Agriculture and Natural Resources,3011,"Irrigation, Drainage, and Flood Protection",,Social Development,Gender Equity,Governance,,,,,,,HS,,
PRF,PRF,2005,4575,,3902601,CAM,SSTA for the Cambodia Business Initiative in Rural Development,PRF,,E,,,150, ,, ,04/05/2005,,CAM,SERD,CARM,Multidonor,AD,E,C,,3300,Finance,3313,Small and Medium Enterprise Finance and Leasing,,Economic Growth,Private Sector Development,,,,,,,,,,
PRF,PRF,2005,4580,,3823401,PRC,NGO-Government Partnerships in Village-Level Poverty Alleviation,PRF,,E,,,1000, ,, ,04/20/2005,,PRC,EARD,PRCM,Multidonor,AD,E,C,,3600,Public Sector Management,3601,Public Administration,,Social Development,Governance,,,,,,,"DR 2009. para on TF, project desc and achievements, pp 12. Case Study: Using NGOs to Fight Poverty, pp.26-27.",HS,,
PRF,PRF,2005,4598,,3753002,TAJ,Rural Development,PRF,,E,700,,150, ,, ,06/14/2005,,TAJ,CWRD,CWAE,Multidonor,PP,E,C,,3000,Agriculture and Natural Resources,3014,Agriculture and Rural Sector Development,,Economic Growth,Environmental Sustainability,Gender Equity,,Developing rural areas,Natural Resources Conservation,Gender Equity In (Economic) Opportunities,,,,,
PRF,PRF,2005,4602,,3857301,PAK,Support to Implementation of Gender Reform Action Plans,PRF,,J,100,,800, ,, ,06/24/2005,,PAK,CWRD,PRM,Multidonor,AD,J,C,,3600,Public Sector Management,3603,Economic and Public Affairs Management,,Gender Equity,,,,,,,,,Successful,,
PRF,PRF,2005,4632,,3769701,MON,Urban Development and Housing Projects,PRF,,J,350,,250, ,, ,08/18/2005,,MON,EARD,EASS,Multidonor,PP,J,C,,3800,Water and Other Municipal Infrastructure and Services,3813,Urban Sector Development,,Social Development,Environmental Sustainability,,,,,,,,,,
PRF,PRF,2005,4638,,3910001,VIE,Implementing the Regulatory and Supervisory Frameworkfor Microfinance,PRF,,E,,,250, ,, ,08/29/2005,,VIE,SERD,SEGF,Multidonor,AD,E,C,,3300,Finance,3304,Microfinance,,Private Sector Development,Governance,Capacity Development,,,,,,,S,,
PRF,PRF,2005,4649,,3763301,PRC,Alternative Energy Supply for Rural Poor in Remote Areas,PRF,,E,,,500, ,, ,09/21/2005,,PRC,EARD,EAEN,Multidonor,AD,E,C,,3200,Energy,3203,Renewable Energy,,Economic Growth,Environmental Sustainability,,,"Promoting Economic Efficiency and Enabling Business environment,Widening Access To Markets and Economic Opportunities",,,,,HS,,
PRF,PRF,2005,4653,,3256601,RMI,Increasing Ownership and Effective Demand for Improved Urban Waste Management,PRF,,E,,,300, ,, ,09/22/2005,,RMI,PARD,PAHQ,Multidonor,AD,E,C,,3800,Water and Other Municipal Infrastructure and Services,3802,Waste Management,,Economic Growth,Environmental Sustainability,,,Developing urban areas,Urban Environmental Improvement,,,,S,,
PRF,PRF,2005,4664,,,TAJ,Farm Analysis and Awareness-Raising for Debt Resolution,PRF,,E,,,800, ,, ,10/04/2005,,TAJ,CWRD,CWAE,Multidonor,AD,E,C,,3000,Agriculture and Natural Resources,3001,Agricultural Production and Markets,,Economic Growth,Social Development,,,Developing rural areas,,,,,,,
PRF,PRF,2005,4679,,3912301,VIE,Capacity Building Support to Dak Nong Province forImproving Poverty Reduction and Growth Performance,PRF,,E,,,650, ,, ,10/31/2005,,VIE,SERD,VRM,Multidonor,AD,E,C,,3600,Public Sector Management,3603,Economic and Public Affairs Management,,Economic Growth,Social Development,Private Sector Development,,Promoting Economic Efficiency and Enabling Business environment,"Human Development,Indigenous Peoples",,,,S,,
PRF,PRF,2005,4680,,3761801,PRC,Alternative Livelihood Options to Facilitate Coal Sector Restructuring,PRF,,E,,,300, ,, ,11/02/2005,,PRC,EARD,EAEN,Multidonor,AD,E,C,,3200,Energy,3215,Energy Sector Development,,Economic Growth,Social Development,,,Promoting Economic Efficiency and Enabling Business environment,Human Development,,,,S,,
PRF,PRF,2005,4689,,3937901,VIE,Developing Benefit Sharing Mechanisms for People Adversely Affected by Power Generation Projects,PRF,,E,,,150, ,, ,11/14/2005,,VIE,SERD,SEEW,Multidonor,AD,E,C,,3200,Energy,3214,Energy Efficiency and Conservation,,Social Development,,,,,,,,,,,
PRF,PRF,2005,4690,,3938701,VIE,Strengthening Institutional Capacity of Local Stakeholders forImplementation of Son La Livelihood & Resettlement Plan,PRF,,E,,,1000, ,, ,11/14/2005,,VIE,SERD,SEID,Multidonor,AD,E,C,,3200,Energy,3215,Energy Sector Development,,Social Development,Gender Equity,Capacity Development,,"Indigenous Peoples,Involuntary Resettlement",Gender Equity In (Human) Capabilities,Institutional Development,,,S,,
PRF,PRF,2005,4694,,3760001,PRC,Urban Poverty Strategy Study II,PRF,,E,,,300, ,, ,11/23/2005,,PRC,EARD,EASS,Multidonor,AD,E,C,,3800,Water and Other Municipal Infrastructure and Services,3813,Urban Sector Development,,Social Development,,,,Human Development,,,,,PS,,
PRF,PRF,2005,4707,,3923001,BAN,Participation of the Urban Poor in Municipal Governance Project,PRF,,E,,,480, ,, ,12/02/2005,,BAN,SARD,SAUD,Multidonor,AD,E,C,,3800,Water and Other Municipal Infrastructure and Services,3813,Urban Sector Development,,Gender Equity,Governance,Capacity Development,,Gender Equity In Empowerment And Rights,Civil Society Participation,Organizational Development,,,S,,
PRF,PRF,2005,4714,,3907601,VIE,"Air Pollution, Poverty, & Health Effects in Ho Chi Minh City",PRF,,E,,,600, ,, ,12/05/2005,,VIE,SERD,SEAE,Multidonor,AD,E,C,,3800,Water and Other Municipal Infrastructure and Services,3813,Urban Sector Development,,Environmental Sustainability,Social Development,,,"Urban Environmental Improvement,Environmental Policy And Legislation",Human Development,,,,Successful,,
PRF,PRF,2005,4740,,3524601,BAN,Command Area Development Project II,PRF,,E,,,350, ,, ,12/19/2005,,BAN,SARD,SANS,Multidonor,PP,E,C,,3000,Agriculture and Natural Resources,3011,"Irrigation, Drainage, and Flood Protection",,Economic Growth,,,,Developing rural areas,,,,,,,
PRF,PRF,2005,4754,,3517401,NEP,Preparing the Education Sector Devt. Program I,PRF,,E,450,,150, ,, ,12/21/2005,,NEP,SARD,SANS,Multidonor,PP,E,C,,3100,Education,3106,Education Sector Development,,Social Development,,,,Human Development,,,,,,,
PRF,PRF,2005,4755,,3953201,CAM,Developing Deposit Services in Rural Cambodia,PRF,,E,,,600, ,, ,12/21/2005,,CAM,SERD,SEGF,Multidonor,AD,E,C,,3300,Finance,3304,Microfinance,,Economic Growth,Private Sector Development,Capacity Development,,Developing rural areas,Private Sector Investment,Organizational Development,,,S,,
PRF,PRF,2005,4759,,3900601,NEP,Reaching the Most Disadvantaged Groups in Mainstream Rural Development,PRF,,E,,,685, ,, ,12/22/2005,,NEP,SARD,SANS,Multidonor,AD,E,C,,3400,Health and Social Protection,3405,Social Protection,,Social Development,Gender Equity,,,,"Gender Equity In (Human) Capabilities,Gender Equity In (Economic) Opportunities,Gender Equity In Empowerment And Rights",,,,S,,
PRF,PRF,2005,6113,,,REG,Making Markets Work Better for the Poor,PRF,,E,,,385, ,, ,11/21/2005,,REG,SERD,VRM,Multidonor,RE,E,C,,3600,Public Sector Management,3603,Economic and Public Affairs Management,,Economic Growth,Social Development,,,,,,,,Successful,,
PRF,PRF,2005,6243,,3904001,REG,GMS for Strengthening Malaria Control for Ethnic Minorities,PRF,,E,,,750, ,, ,05/23/2005,,REG,SERD,SESS,Multidonor,RE,E,C,,3400,Health and Social Protection,3412,Health Programs,,Social Development,Regional Cooperation and Integration,,,"Human Development,Indigenous Peoples",,,,,S,,
PRF,PRF,2005,6245,,,REG,Strengthening Pro-Poor Policy in the Pacific,PRF,,J,,,925, ,, ,06/10/2005,,REG,PARD,PAHQ,Multidonor,RE,J,C,,3600,Public Sector Management,3603,Economic and Public Affairs Management,,Economic Growth,Social Development,Governance,,Promoting Economic Efficiency and Enabling Business environment,Human Development,"Public Administration (National,Decentralized,Regional)",,,S,,
PRF,PRF,2005,6247,,3622802,REG,HIV/AIDS Vulnerability & Risk Reduction among Ehtnic Minority Groups through Communication Strategies,PRF,,E,,,700, ,, ,07/01/2005,,REG,SERD,SESS,Multidonor,RE,E,C,,3400,Health and Social Protection,3412,Health Programs,,Social Development,Regional Cooperation and Integration,Gender Equity,,Indigenous Peoples,,,,,HS,,
PRF,PRF,2005,6248,,3856501,REG,Legal Empowerment for Women and Disadvantaged Groups,PRF,,E,,,550, ,, ,07/19/2005,,REG,SDCC,SDGG,Multidonor,RE,E,C,,3600,Public Sector Management,3605,Law and Judiciary,,Social Development,Gender Equity,,,,Gender Equity In Empowerment And Rights,,,,HS,,
PRF,PRF,2005,6260,,3808101,REG,Socioeconomic Impact of Road Crashes,PRF,,E,,,925, ,, ,10/03/2005,,REG,SDCC,SDAS,Multidonor,RE,E,C,,3700,Transport and ICT,3701,Road Transport,,Social Development,Capacity Development,Capacity Development,,Other vulnerable groups,"Client Relations,Network,And Partnership Development",,,,,,
PRF,PRF,2005,6270,,3920601,REG,Facilitating Knowledge Mgt for Pro-Poor Policies and Projects,PRF,,E,,,980, ,, ,11/23/2005,,REG,SDCC,SDGG,Multidonor,RE,E,C,,3600,Public Sector Management,3603,Economic and Public Affairs Management,,Social Development,Gender Equity,Capacity Development,,,,,,,S,,
PRF,PRF,2005,6278,,,REG,Innovative Info & Comm Technology in Education and Its Potentialfor Reducing Poverty in the Asia & Pacific Region,PRF,,E,,,800, ,, ,12/02/2005,,REG,SDCC,RSCG,Multidonor,RE,E,C,,3100,Education,3101,Pre-Primary and Basic Education,,Social Development,Regional Cooperation and Integration,,,Human Development,,,,,HS,,
PRF,PRF,2005,6284,,3910901,REG,Development of Catastrophe Risk Insurance Mechanisms,PRF,,E,,,150, ,, ,12/09/2005,,REG,SDCC,RSCG,Multidonor,RE,E,C,,3300,Finance,3305,Insurance and Contractual Savings,,Economic Growth,,,,,,,,,,,
PRF,PRF,2005,6289,,3902501,REG,Core Environment Program and Biodiversity Conservation Corridors Initiative in the GMS,PRF,,J,1220,,550, ,, ,12/16/2005,,REG,SERD,SEAE,Multidonor,RE,J,C,,3000,Agriculture and Natural Resources,3012,Land-Based Natural Resources Management,,Economic Growth,Environmental Sustainability,Regional Cooperation and Integration,,,"Natural Resources Conservation,Global And Regional Transboundary Environmental Issues,Environmental Policy And Legislation",,,,,,
PRF,PRF,2005,6296,,3740901,REG,Developing Pro-Poor Governance Capability and Knowledge,PRF,,E,,,875, ,, ,12/21/2005,,REG,SDCC,RSCG,Multidonor,RE,E,C,,3600,Public Sector Management,3604,Decentralization,,Governance,,,,,,,,,HS,,
PRF,PRF,2006,4408,,3807901,KGZ,"A Study of the Impact of Land Reform on Agriculture, Poverty Reduction and Environment",PRF,,E,,,130, ,, ,01/25/2006,,KGZ,CWRD,CWAE,Multidonor,AD,E,C,,3000,Agriculture and Natural Resources,3014,"Agricultural Policy, Institutional and Capacity Development",,Economic Growth,,,,,,,,,U,,
PRF,PRF,2006,4760,,3952501,NEP,Enhancing Poverty Reduction Impact of Road Projects,PRF,,E,,,350, ,, ,01/03/2006,,NEP,SARD,NRM,Multidonor,AD,E,C,,3700,Transport and ICT,3701,Road Transport,,Social Development,,,,,,,,,HS,,
PRF,PRF,2006,4761,,3957201,SRI,Microinsurance Sector Development Project,PRF,,E,,,600, ,, ,01/03/2006,,SRI,SARD,SAGF,Multidonor,AD,E,C,,3300,Finance,3304,Microfinance,,Governance,,,,,,,,,PS,,
PRF,PRF,2006,4774,,3900401,NEP,Economic & Social Inclusion of the Disadvantaged Poor ThroughLivelihood Enhancement with Micro-Irrigation,PRF,,E,,,450, ,, ,03/20/2006,,NEP,SARD,NRM,Multidonor,AD,E,C,,3000,Agriculture and Natural Resources,3014,Agriculture and Rural Sector Development,,Economic Growth,Gender Equity,,,,,,,,S,,
PRF,PRF,2006,4776,,3808801,NEP,Enabling the Provate Sector to Undertake Poverty-Focused WaterDistribution & Strengthening of Institutional Reforms in Kathmandu Valley,PRF,,J,150,,570, ,, ,03/28/2006,,NEP,SARD,SAUD,Multidonor,AD,J,C,,3800,Water and Other Municipal Infrastructure and Services,3801,Water Supply and Sanitation,,Economic Growth,Private Sector Development,Governance,,,,,,,S,,
PRF,PRF,2006,4777,,3903601,CAM,Dormitories and Learning Centers for Secondary School Girls,PRF,,E,,,800, ,, ,04/03/2006,,CAM,SERD,SESS,Multidonor,AD,E,C,,3100,Education,3103,Upper Secondary Education,,Social Development,Gender Equity,,,,,,,,S,,
PRF,PRF,2006,4787,,4000401,LAO,SSTA for Revitalizing Community Demand for Immunization Project,PRF,,E,,,140, ,, ,05/10/2006,,LAO,SERD,SESS,Multidonor,AD,E,C,,3400,Health and Social Protection,3412,Health Programs,,Social Development,Gender Equity,,,,,,,,,,
PRF,PRF,2006,4820,,3753603,UZB,Implementation & Monitoring of Policy Reforms in the Agriculture Society,PRF,,E,200,,600, ,, ,07/24/2006,,UZB,CWRD,CWEN,Multidonor,AD,E,C,,3000,Agriculture and Natural Resources,3014,Agriculture and Rural Sector Development,,Economic Growth,,,,,,,,,S,,
PRF,PRF,2006,6306,,,REG,Mainstreaming MFDR in Support of Poverty Reduction in South Asia,PRF,,E,,,1800, ,, ,01/27/2006,,REG,SARD,SLRM,Multidonor,RE,E,C,,3600,Public Sector Management,3603,Economic and Public Affairs Management,,Economic Growth,Regional Cooperation and Integration,,,,,,,,Satisfactory,,
PRF,PRF,2006,6308,,3926101,REG,Scaling Up the Social Protection Index for Committed Poverty Reduction,PRF,,E,,,900, ,, ,03/06/2006,,REG,SARD,SANS,Multidonor,RE,E,C,,3400,Health and Social Protection,3405,Social Protection,,Social Development,,,,,,,,,HS,,
PRF,PRF,2006,6315,,4003801,REG,Remittances & Poverty in Central Asia & South Caucasus,PRF,,E,300,,1000, ,, ,04/07/2006,,REG,CWRD,CWOC,Multidonor,RE,E,C,,3600,Public Sector Management,3603,Economic and Public Affairs Management,,Economic Growth,Private Sector Development,Governance,,,,,,,S,,
PRF,PRF,2006,6316,,3933401,REG,Asian Development Community Broadcasting Initiative,PRF,,E,,,150, ,, ,04/05/2006,,REG,SDCC,NGOC,Multidonor,RE,E,C,,3700,Transport and ICT,3706,ICT,,Social Development,,,,,,,,,,,
PRF,PRF,2007,4933,,3925701,PRC,Facility for Policy Reform & Poverty Reduction,PRF,,J,900,,65, ,, ,05/28/2007,,PRC,EARD,PRCM,Multidonor,AD,J,C,,3900,Multisector,3900,Multisector,,Economic Growth,Social Development,,,,,,,,Successful,,
Private Sector,Private Sector,2003,6016,,,REG,Clean Air Initiatives for Asian Cities ,Private Sector,,E,,,145, ,, ,04/11/2003,,REG,SDCC,SDES,Multidonor,RE,E,PS,,3800,Water and Other Municipal Infrastructure and Services,3813,"Urban Policy, Institutional and Capacity Development",,,,,,,,,,,HS,,
Private Sector,Private Sector,2003,6016,,,REG,Clean Air Initiatives for Asian Cities ,Private Sector,,J,,,30, ,, ,08/13/2003,,REG,SDCC,SDES,Multidonor,RE,J,PS,,3800,Water and Other Municipal Infrastructure and Services,,,,,,,,,,,,,HS,,
Private Sector,Private Sector,2003,6016,,,REG,Clean Air Initiatives for Asian Cities ,Private Sector,,E,,,175, ,, ,11/05/2003,,REG,SDCC,SDES,Multidonor,RE,E,PS,,3800,Water and Other Municipal Infrastructure and Services,,,,,,,,,,,,,HS,,
Private Sector,Private Sector,2004,6016,,3527201,REG,Clean Air Initiatives for Asian Cities ,Private Sector,,J,,,32.5, ,, ,04/12/2004,,REG,SDCC,SDES,Multidonor,RE,J,PS,,3800,Water and Other Municipal Infrastructure and Services,3813,Urban Sector Development,,,,,,,,,,,HS,,
Private Sector,Private Sector,2004,6077,,3604602,REG,Road Safety in the Association of Southeast Asian Nations ,Private Sector,,E,,,118, ,, ,06/08/2004,,REG,SDCC,SDAS,Multidonor,RE,E,PS,,3700,Transport and ICT,3704,Air Transport,,,,,,,,,,,S,,
Private Sector,Private Sector,2004,6144,,,REG,Better Air Quality Management in Asia ,Private Sector,,E,,,245, ,, ,11/19/2004,,REG,SDCC,SDES,Multidonor,RE,E,PS,,3800,Water and Other Municipal Infrastructure and Services,3813,Urban Sector Development,,,,,,,,,,,S,,
Private Sector,Private Sector,2005,6144,,3722101,REG,Better Air Quality Management in Asia,Private Sector,,E,,,390, ,, ,08/17/2005,,REG,SDCC,SDES,Multidonor,RE,E,PS,,3800,Water and Other Municipal Infrastructure and Services,3813,"Urban Policy, Institutional and Capacity Development",,"Economic Growth,Social Development","Regional Cooperation and Integration,Environmental Sustainability",,,,,,,,S,,
Private Sector,Private Sector,2007,6144,,3722101,REG,Better Air Quality Management in Asia,Private Sector,,E,,,75, ,, ,08/26/2007,,REG,SDCC,SDES,Multidonor,RE,E,PS,,3800,Water and Other Municipal Infrastructure and Services,3813,"Urban Policy, Institutional and Capacity Development",,"Economic Growth,Social Development","Regional Cooperation and Integration,Environmental Sustainability",,,,,,,,S,,
P.R.C.,,2006,6127,,,REG,ASEAN+3 Regional Guarantee Mechanism (Supp),PRC,,E,,,35, ,,,01/09/2006,,REG,OREI,OREI,Single Donor,RE,E,PS,,3300,Finance,3311,Money and Capital Markets,,Economic Growth,Regional Cooperation and Integration,Private Sector Development,,,,,,,Successful,,
RCIFPF-ICFF,RCIFPF-ICFF,2008,6505,,4164801,REG,"Enhancing Financial Disclosure Standards in Armenia, Azerbaijan, and Georgia",RCIFPF-ICFF,,E,,,600, ,, ,12/10/2008,,REG,CWRD,CWFM,Single Donor,RE,E,C,,3300,Finance,3315,Finance Sector Development,,Regional Cooperation and Integration,Governance,,,,,,,,Successful,,
RCIFPF-ICFF,RCIFPF-ICFF,2008,6509,,41517-012,REG,Minimizing Foreign Exchange Settlement Risk in the ASEAN+3 Region: Support for Group of Experts,RCIFPF-ICFF,,E,,,850, ,, ,12/16/2008,,REG,OREI,OREI,Single Donor,R-RD,E,C,,3300,Finance,3311,Money and Capital Markets,,Economic Growth,Regional Cooperation and Integration,Private Sector Development,,,,,,,,,
RCIFPF-ICFF,RCIFPF-ICFF,2008,6514,,4057201,REG,Harmonization of Bond Standards in ASEAN+3,RCIFPF-ICFF,,J,,,450, ,, ,12/16/2008,,REG,OREI,OREI,Single Donor,RE,J,C,,3300,Finance,3311,Money and Capital Markets,,Economic Growth,Regional Cooperation and Integration,Private Sector Development,,,,,,,Successful,,
RCIFPF-ICFF,RCIFPF-ICFF,2009,6424,,4168301,REG,Enhancing Effective Regulation of Water and Energy Infrastructure and Utility Services,RCIFPF-ICFF,,E,,,400,08 Dec 2008,, ,08/28/2009,12/08/2008,REG,OGC,OGC,Single Donor,RE,E,C,,3600,Public Sector Management,3603,Economic and Public Affairs Management,,Economic Growth,Private Sector Development,Governance,,,,,,,,,
RCIFPF-ICFF,RCIFPF-ICFF,2009,7248,,4252801,REG,South Asia Strategic Framework for Aid for Trade Road Map,RCIFPF-ICFF,,E,,,600,17 Feb 2009,, ,03/10/2009,02/17/2009,REG,SARD,SAFM,Single Donor,RE,E,C,,3500,Industry and Trade,3504,Trade and Services,,Capacity Development,Economic growth,Regional Cooperation,,,,,,DR 2012. story (para) for ICFF pp47.,Successful,,
RCIFPF-ICFF,RCIFPF-ICFF,2009,7290,,4245301,REG,Achieving Urban Water Security for South Asia,RCIFPF-ICFF,,E,,,850,09 Oct 2008,, ,06/01/2009,10/09/2008,REG,SARD,SAUD,Single Donor,R-CD,E,C,,3800,Water and Other Municipal Infrastructure and Services,3801,Water Supply and Sanitation,,Capacity Development,Governance,Social Development,,,,,,,,,
RCIFPF-ICFF,RCIFPF-ICFF,2009,7477,,4022201,REG,ASEAN+3 Regional Guarantee and Investment Mechanisim (Phase 3),RCIFPF-ICFF,,E,,,1370,18 Dec 2009,, ,12/21/2009,12/18/2009,REG,OREI,OREI,Single Donor,R-PA,E,C,,3300,Finance,3311,Money and Capital Markets,,Economic growth,Private Sector Development,Regional Cooperation,,,,,,"DR 2011. para on RCIFPF, pp 25.",Successful,,
RCIFPF-ICFF,RCIFPF-ICFF,2010,7521,,,REG,"Strengthening Local Chambers of Commerce and Industry along the East-West Economic Corridor to Promote Trade, Investment and Value Chains",RCIFPF-ICFF,,E,,,600,02 Dec 2008,, ,03/30/2010,12/02/2008,REG,SERD,SEOD,Single Donor,R-PA,E,C,,3500,Industry and Trade,,,,Economic Growth,Private Sector Development,Regional Cooperation,,Promoting Economic Efficiency and Enabling Business environment,Private Sector Investment,Trade and Investments,,,Highly Successful,,
RCIFPF-ICFF,RCIFPF-ICFF,2010,7527,,4343101,REG,Best Practice for Regulatory Framework and Use of Credit Rating Information of Domestic Credit Rating Agencies in South Asia,RCIFPF-ICFF,,E,,,550,09 Apr 2010,,,05/11/2010,04/09/2010,REG,SARD,SAFM,Single Donor,R-PA,E,C,,3300,Finance,3315,Finance Sector Development,,Economic Growth,Private Sector Development,Regional Cooperation,Governance,Promoting Economic Efficiency and Enabling Business environment,Private Sector Investment,Money and Finance,Economic and Financial governance,,Successful,,
RCIFPF-ICFF,RCIFPF-ICFF,2010,7536,,4233901,REG,Improving Liquidity of Bond Market in ASEAN+3,RCIFPF-ICFF,,E,,,1250,09 Apr 2010,,,05/19/2010,04/09/2010,REG,OREI,OREI-FS,Single Donor,R-PA,E,C,,3300,Finance,3311,Money and Capital Markets,,Economic Growth,Regional Cooperation,,,Promoting macroeconomic stability,"Trade and Investments,Money and Finance",,,"DR 2010. para on RCI-interregional capital markets/new project pp 29. DR 2011. para on RCIFPF, pp 25.",,,
RCIFPF-ICFF,RCIFPF-ICFF,2010,7549,,4318001,REG,Developing a Regional Social Investment Exchange Initiative,RCIFPF-ICFF,,E,,,600,23 Dec 2009,,,06/18/2010,12/23/2009,REG,SDCC,RSGS,Single Donor,R-RD,E,C,,3900,Multisector,3900,Multisector,,Regional Cooperation,Capacity Development,,,"Trade and Investments,Other Regional Public Goods",Institutional Development,,,,Successful,,
RCIFPF-ICFF,RCIFPF-ICFF,2010,7552,,4134801,REG,Support for Trade Facilitation in the Brunei Darussalam-Indonesia-Malaysia-Philippines East ASEAN Growth Area,RCIFPF-ICFF,,J,,,1000,09 Apr 2010,,,06/14/2010,04/09/2010,REG,SERD,SEOD,Single Donor,R-PA,J,C,,3500,Industry and Trade,3504,Trade and Services,,Regional Cooperation,Economic Growth,Governance,,Trade and Investments,Promoting Economic Efficiency and Enabling Business environment,"Public Administration (National,Decentralized,Regional)",,,,,
