MDTF-WFPF,MDTF-WFPF,2008,7219,,4001702,PRC,Enabling the Protection of Jiaozhou Bay Water Quality and Wetland Ecosystem,MDTF-WFPF,,J,350,,400, ,, ,12/17/2008,,PRC,EARD,EAAE,Multidonor,PP,J,C,,3000,Agriculture and Natural Resources,3013,Water-Based Natural Resources Management,,Economic Growth,Environmental Sustainability,Private Sector Development,,,,,,,Successful,,
MDTF-WFPF,MDTF-WFPF,2009,4573,,43166-122,IND,Water Users Association Empowerment for Improved Irrigation Management (Supplementary),MDTF-WFPF,,E,,,400,15 Jan 2008,, ,08/07/2009,01/15/2008,IND,SARD,SANS,Multidonor,CD,E,C,,3000,Agriculture and Natural Resources,3011,Irrigation,,Environmental Sustainability,Governance,,,,,,,"DR 2012. para in SARD section on Partnership Results, pp 19.",,,
MDTF-WFPF,MDTF-WFPF,2009,6498,,42384-012,REG,Knowledge and Innovation Support for ADB's Water Financing Program,MDTF-WFPF,,J,,,1200,17 Jul 2009,, ,07/01/2009,07/17/2009,REG,SDCC,SDAS,Multidonor,R-CD,J,C,,3000,Agriculture and Natural Resources,3013,Water-Based Natural Resources Management,,Economic Growth,Environmental Sustainability,,,"Developing urban areas,Developing rural areas",Natural Resources Conservation,,,,,,
MDTF-WFPF,MDTF-WFPF,2009,7228,,4154801,KGZ,Issyk-Kul Sustainable Development Project,MDTF-WFPF,,J,100,,700,12 Jan 2009,, ,01/20/2009,01/12/2009,KGZ,CWRD,CWUS,Multidonor,PP,J,C,,3800,Water and Other Municipal Infrastructure and Services,3813,Urban Sector Development,,Economic growth,Environmental Sustainability,Private Sector Development,,,,,,,,,
MDTF-WFPF,MDTF-WFPF,2009,7240,,4248901,UZB,Water Supply and Sanitation Services,MDTF-WFPF,,J,150,,850,12 Jan 2009,, ,02/20/2009,01/12/2009,UZB,CWRD,CWUS,Multidonor,PP,J,C,,3800,Water and Other Municipal Infrastructure and Services,3801,Water Supply and Sanitation,,Capacity Development,Environmental Sustainability,Environmental Sustainability,Gender Equity,,,,,,,,
MDTF-WFPF,MDTF-WFPF,2009,7261,,4202501,PRC,Strategy for Drought Management,MDTF-WFPF,,J,400,,230,12 Jan 2009,, ,03/26/2009,01/12/2009,PRC,EARD,EAAE,Multidonor,PA,J,C,,3000,Agriculture and Natural Resources,3012,Land-Based Natural Resources Management,,Capacity Development,Economic growth,Environmental Sustainability,Social Development,,,,,,Highly Successful,,
MDTF-WFPF,MDTF-WFPF,2009,7320,,3617303,SRI,Supporting Capacity Development for Wastewater Management Services in Colombo,MDTF-WFPF,,J,500,,150,17 Jun 2009,, ,07/28/2009,06/17/2009,SRI,SARD,SAUD,Multidonor,CD,J,C,,3800,Water and Other Municipal Infrastructure and Services,3801,Water Supply and Sanitation,,Capacity Development,Environmental Sustainability,Social Development,,,,,,DR 2012. story (para) for MDTF-WFPF pp45.,Successful,,
MDTF-WFPF,MDTF-WFPF,2009,7321,,4038901,PAK,Punjab Cities Improvement Investment Program,MDTF-WFPF,,J,1000,,400,13 May 2009,, ,07/29/2009,05/13/2009,PAK,CWRD,CWUS,Multidonor,PP,J,C,,3800,Water and Other Municipal Infrastructure and Services,3801,Water Supply and Sanitation,,Capacity Development,Environmental Sustainability,Private Sector Development,,,,,,,Partly Successful,,
MDTF-WFPF,MDTF-WFPF,2009,7367,,4332901,PHI,Pasig River Catchment Sewerage Project,MDTF-WFPF,,E,,,300,21 Aug 2009,, ,10/26/2009,08/21/2009,PHI,PSOD,PSIF,Multidonor,PP,E,C,,3800,Water and Other Municipal Infrastructure and Services,3801,Water Supply and Sanitation,,Environmental Sustainability,Private Sector Development,,,,,,,,Successful,,
MDTF-WFPF,MDTF-WFPF,2009,7432,,4224801,BAN,Second Chittagong Hill Tracts Rural Development Project (CHTRDP II),MDTF-WFPF,,J,900,,265,21 Aug 2009,, ,12/07/2009,08/21/2009,BAN,SARD,SANS,Multidonor,PP,J,C,,3000,Agriculture and Natural Resources,3014,Agriculture and Rural Sector Development,,Capacity Development,Economic growth,Gender Equity,Social Development,,,,,,,,
MDTF-WFPF,MDTF-WFPF,2010,4573,,43166-122,IND,Advanced Project Preparedness for Poverty Reduction - Water Users Association Empowerment for Improved Irrigation Management in Chhattisgarh (Subproject 5) (3rd Supplementary),MDTF-WFPF,,E,,,150,18 Jan 2008,,,08/10/2010,01/18/2008,IND,SARD,SANS,Multidonor,CD,E,C,,3000,Agriculture and Natural Resources,3011,Irrigation,,Economic Growth,Governance,,,,Civil Society Participation,,,"DR 2012. para in SARD section on Partnership Results, pp 19.",,,
MDTF-WFPF,MDTF-WFPF,2010,6498,,42384-012,REG,Knowledge and Innovation Support for ADB's Water Financing Program,MDTF-WFPF,,J,,,1500,09 Mar 2010,,,03/26/2010,03/09/2010,REG,SDCC,SDAS,Multidonor,R-CD,J,C,,3000,Agriculture and Natural Resources,3013,Water-Based Natural Resources Management,,Economic Growth,Environmental Sustainability,,,"Developing urban areas,Developing rural areas",Natural Resources Conservation,,,,,,
MDTF-WFPF,MDTF-WFPF,2010,7091,,,VIE,Ho Chi Min City Water Supply Project,MDTF-WFPF,,J,,,300,09 Mar 2010,,,04/16/2010,03/09/2010,VIE,SERD,SEEW,Multidonor,PP,J,C,,3800,Water and Other Municipal Infrastructure and Services,3801,Water Supply and Sanitation,,Economic Growth,Private Sector Development,Capacity Development,,Developing urban areas,Public Private Partnerships,Institutional Development,,,,,
MDTF-WFPF,MDTF-WFPF,2010,7581,,4415806,REG,Enabling Climate Change Responses in Asia and the Pacific- Supporting Investments in Water and Climate Change (Subproject 1),MDTF-WFPF,,E,,,1000,13 May 2009,,,08/18/2010,05/13/2009,REG,SDCC,SDAS,Multidonor,C-CD,E,C,,3900,Multisector,3900,Multisector,,Environmental Sustainability,Capacity Development,Regional Cooperation and Integration,Social Development,"Natural Resources Conservation,Urban Environmental Improvement,Eco-Efficiency,Global And Regional Transboundary Environmental Issues,Environmental Policy And Legislation",Institutional Development,Other Regional Public Goods,"Other vulnerable groups,Disaster Risk Management",,,,
MDTF-WFPF,MDTF-WFPF,2010,7658,,4068302,PRC,Effective Reservoir Utilization for Integrated Water Resources Management,MDTF-WFPF,,J,300,,200,07 Jul 2010,,,11/19/2010,07/07/2010,PRC,EARD,EAAE,Multidonor,PA,J,C,,3000,Agriculture and Natural Resources,3013,Water-Based Natural Resources Management,,Economic Growth,Social Development,Environmental Sustainability,,Promoting Economic Efficiency and Enabling Business environment,Disaster Risk Management,Natural Resources Conservation,,,Successful,,
MDTF-WFPF,MDTF-WFPF,2010,7731,,4201603,PRC,Strengthening Participatory Irrigation Management and Project Management Capacity in Qinghai Province,MDTF-WFPF,,J,500,,200,09 Mar 2010,,,12/16/2010,03/09/2010,PRC,EARD,EAAE,Multidonor,CD,J,C,,3000,Agriculture and Natural Resources,3011,"Irrigation, Drainage, and Flood Protection",,Capacity Development,Economic Growth,Environmental Sustainability,,Institutional Development,Widening Access To Markets and Economic Opportunities,Natural Resources Conservation,,,,,
MDTF-WFPF,MDTF-WFPF,2011,6498,,42384-012,REG,Knowledge and Innovation Support for ADB's Water Financing Program (Supplementary) 2,MDTF-WFPF,,J,,,1500,09 Mar 2010,,,11/16/2011,03/09/2010,REG,SDCC,SDAS,Multidonor,R-CD,J,C,,3000,Agriculture and Natural Resources,3013,Water-Based Natural Resources Management,,Economic Growth,Environmental Sustainability,,,,,,,,,,
MDTF-WFPF,MDTF-WFPF,2011,7941,,4410601,REG,Preparing a Water Supply and Sanitation Handbook for Southeast Asia,MDTF-WFPF,,E,,,225,02 Nov 2011,,,11/22/2011,11/02/2011,REG,SERD,SEUW,Multidonor,R-RD,E,C,,3800,Water and Other Municipal Infrastructure and Services,3801,Water Supply and Sanitation,,,,,,,,,,,Successful,,
MDTF-WFPF,MDTF-WFPF,2011,8015,,4535302,REG,Developing Water Resources Sector Strategies in Central and West Asia,MDTF-WFPF,,E,1000,,500, ,,,12/22/2011,,REG,CWRD,CWER,Multidonor,R-PA,E,C,,3000,Agriculture and Natural Resources,3011,"Irrigation, Drainage, and Flood Protection",,,,,,,,,,,,,
MDTF-WFPF,MDTF-WFPF,2012,7122,,41665-012,PHI,Water District Development Sector (Supplementary),MDTF-WFPF,,,,,70, ,,,09/20/2012,,PHI,SERD,SEUW,Multidonor,PP,,C,,3800,Water and Other Municipal Infrastructure and Services,3813,Urban Sector Development,,,,,,,,,,,,,
MDTF-WFPF,MDTF-WFPF,2012,7713,,44503-001,IND,Project Management Capacity Building for Water Resources Sector Executing Agencies,MDTF-WFPF,,,225,,200,29 Oct 2012,,,11/19/2012,10/29/2012,IND,SARD,SAER,Multidonor,CD,,C,,3000,Agriculture and Natural Resources,3011,"Irrigation,Drainage,and Flood Protection",,Capacity Development,Economic Growth,Environmental Sustainability,,Institutional Development,"Knowledge,Science,And Technological Capacities",Natural Resources Conservation,,,Successful,,
MDTF-WFPF,MDTF-WFPF,2012,7970,,45007-001,MON,Ulaanbaatar Urban Services and Ger Areas Development Investment Program (Supplementary),MDTF-WFPF,,J,,,200,01 Mar 2012,,,05/25/2012,03/01/2012,MON,EARD,EASS,Multidonor,PP,J,C,,3800,Water and Other Municipal Infrastructure and Services,3801,Water Supply and Sanitation,,,,,,,,,,,,,
MDTF-WFPF,MDTF-WFPF,2012,8050,,43448-012,NEP,Bagmati River Basin Improvement (Supplementary),MDTF-WFPF,,,,,470,29 Oct 2012,,,11/06/2012,10/29/2012,NEP,SARD,SAER,Multidonor,PP,,C,,3000,Agriculture and Natural Resources,3013,Water-Based Natural Resources Management,,Environmental Sustainability,Economic Growth,Social Development,Capacity Development,Natural Resources Conservation,"Promoting macroeconomic stability,Widening Access To Markets and Economic Opportunities",Disaster Risk Management,"Institutional Development,Organizational Development",,,,
MDTF-WFPF,MDTF-WFPF,2012,8089,,45017-001,IND,Operational Research to Support Mainstreaming of Integrated Flood Management under Climate Change,MDTF-WFPF,,J,,,200, ,,,06/01/2012,,IND,SARD,INRM,Multidonor,PA,J,C,,3000,Agriculture and Natural Resources,3011,Irrigation,,Environmental Sustainability,Economic Growth,,,Natural Resources Conservation,"Knowledge,Science,And Technological Capacities",,,,,,
MDTF-WFPF,MDTF-WFPF,2012,8166,,,IND,Climate Adaptation through Sub-Basin Development Investment program,MDTF-WFPF,,,1000,,140, ,,,09/20/2012,,IND,SARD,SAER,Multidonor,PP,,C,,3000,Agriculture and Natural Resources,3011,"Irrigation, Drainage, and Flood Protection",,,,,,,,,,,,,
MDTF-WFPF,MDTF-WFPF,2012,8172,,,PRC,Jilin Urban Services Improvement Project,MDTF-WFPF,,,700,,150, ,,,09/13/2012,,PRC,EARD,EASS,Multidonor,PP,,C,,3900,Multisector,3900,Multisector,,,,,,,,,,,,,
MDTF-WFPF,MDTF-WFPF,2012,8185,,46085-001,PRC,Pilot Implementation of the Drought Management Strategy,MDTF-WFPF,,J,400,,200,28 Aug 2012,,,10/08/2012,08/28/2012,PRC,EARD,EAER,Multidonor,CD,J,C,,3000,Agriculture and Natural Resources,3013,Water-Based Natural Resources Management,,Economic Growth,Social Development,Environmental Sustainability,Capacity Development,Promoting Economic Efficiency and Enabling Business environment,Disaster Risk Management,Natural Resources Conservation,Institutional Development,,,,
MDTF-WFPF,MDTF-WFPF,2012,8206,,45148-003,SRI,Capacity Development for Non-Revenue Water Reduction,MDTF-WFPF,,E,,,200,01 Mar 2012,,,11/05/2012,03/01/2012,SRI,SARD,SAUW,Multidonor,S-CD,E,C,,3800,Water and Other Municipal Infrastructure and Services,3801,Water Supply and Sanitation,,,,,,,,,,,,,
MDTF-WFPF,MDTF-WFPF,2012,8269,,46089-001,PRC,Biodiversity Strategy and Action Plan for Yunnan Province,MDTF-WFPF,,,400,,200, ,,,12/10/2012,,PRC,EARD,EAER,Multidonor,PA,,C,,3000,Agriculture and Natural Resources,3012,Land-Based Natural Resources Management,,Environmental Sustainability,Capacity Development,,,"Natural Resources Conservation,Global And Regional Transboundary Environmental Issues",Institutional Development,,,,,,
MDTF-WFPF,MDTF-WFPF,2012,8293,,44037-014,PRC,Management and Protection of Wetlands in Weinan City in Shaanxi Province,MDTF-WFPF,,E,,,350,29 Oct 2012,,,12/17/2012,10/29/2012,PRC,EARD,EAER,Multidonor,CD,E,C,,3000,Agriculture and Natural Resources,3011,"Irrigation, Drainage, and Flood Protection",,Economic Growth,Environmental Sustainability,,,Promoting Economic Efficiency and Enabling Business environment,Natural Resources Conservation,,,,,,
MDTF-WFPF,MDTF-WFPF,2012,8306,,46346-001,RMI,Ebeye Water Supply and Sanitation,MDTF-WFPF,,J,,,500,29 Oct 2012,,,12/20/2012,10/29/2012,RMI,PARD,PAUS,Multidonor,PP,J,C,,3900,Multisector,3900,Multisector,,Social Development,Environmental Sustainability,Capacity Development,,Human Development,Urban Environmental Improvement,Institutional Development,,"DR 2012. para in PARD section on New Joint Initiatives, pp 16.",,,
MDTF-WFPF,MDTF-WFPF,2013,6498,,42384-012,REG,Knowledge and Innovation Support for ADB's Water Financing Program (5th Supplementary),MDTF-WFPF,,,,,1000,26 Apr 2013,,,06/07/2013,04/26/2013,REG,SDCC,SDAS,Multidonor,R-CD,,C,,3000,Agriculture and Natural Resources,3013,Water-Based Natural Resources Management,,Economic Growth,Environmental Sustainability,,,,,,,,,,
MDTF-WFPF,MDTF-WFPF,2013,7364,,35182-022,INO,Flood Management in Selected River Basins (Phase II) (Supplementary),MDTF-WFPF,,J,1000,,500,27 Aug 2013,,,10/13/2013,08/27/2013,INO,SERD,SEER,Multidonor,PP,J,C,,3000,Agriculture and Natural Resources,3011,"Irrigation, Drainage, and Flood Protection",,Capacity Development,Economic Growth,Social Development,Environmental Sustainability,"Institutional Development,Organizational Development","Promoting Economic Efficiency and Enabling Business environment,Knowledge,Science,And Technological Capacities",Disaster Risk Management,Natural Resources Conservation,,,,
MDTF-WFPF,MDTF-WFPF,2013,7883,,44214-023,NEP,Building Climate Resilience of Watersheds in Mountain Eco-Regions (Supplementary),MDTF-WFPF,,J,,,500,27 Feb 2013,,,03/12/2013,02/27/2013,NEP,SARD,SAER,Multidonor,PP,J,C,,3000,Agriculture and Natural Resources,3013,Water-Based Natural Resources Management,,,,,,,,,,,,,
MDTF-WFPF,MDTF-WFPF,2013,7914,,45039-001,REG,Harnessing Climate Change Mitigation Initiatives to Benefit Women (Supplementary),MDTF-WFPF,,J,,,300,01 Jul 2013,,,09/04/2013,07/01/2013,REG,SERD,SEUW,Multidonor,R-CD,J,C,,3900,Multisector,3900,Multisector,,,,,,,,,,,,,
MDTF-WFPF,MDTF-WFPF,2013,7926,,44324-012,VIE,Water Resources Development in the Mid- and Northeast Red River Delta (Supplementary),MDTF-WFPF,,,,,450,27 Feb 2013,,,05/22/2013,02/27/2013,VIE,SERD,SEER,Multidonor,PP,,C,,3000,Agriculture and Natural Resources,3011,"Irrigation, Drainage, and Flood Protection",,,,,,,,,,,,,
MDTF-WFPF,MDTF-WFPF,2013,7967,,45072-001,REG,Innovations for More Food with Less Water (Supplementary),MDTF-WFPF,,J,,,300,25 Oct 2013,,,12/13/2013,10/25/2013,REG,SDCC,SDCC-AR,Multidonor,R-RD,J,C,,3000,Agriculture and Natural Resources,3013,Water-Based Natural Resources Management,,,,,,,,,,,,,
MDTF-WFPF,MDTF-WFPF,2013,8053,,42173-012,BAN,Preparing the Khilket Water Treatment Plant (Supplementary),MDTF-WFPF,,,900,,500,01 Jul 2013,,,08/12/2013,07/01/2013,BAN,SARD,SAUW,Multidonor,PP,,C,,3800,Water and Other Municipal Infrastructure and Services,3801,Water Supply and Sanitation,,Environmental Sustainability,Social Development,Private Sector Development,,Urban Environmental Improvement,Human Development,Public Private Partnerships,,,,,
MDTF-WFPF,MDTF-WFPF,2013,8064,,46160-001,TIM,Second District Capitals Water Supply (Supplementary),MDTF-WFPF,,,550,,200,29 Nov 2012,,,06/19/2013,11/29/2012,TIM,PARD,PAUS,Multidonor,PP,,C,,3800,Water and Other Municipal Infrastructure and Services,3801,Water Supply and Sanitation,,,,,,,,,,,,,
MDTF-WFPF,MDTF-WFPF,2013,8115,,45146-001,PHI,Solid Waste Management Sector (Supplementary),MDTF-WFPF,,J,1000,,220,27 Aug 2013,,,10/22/2013,08/27/2013,PHI,SERD,SEUW,Multidonor,PP,J,C,,3800,Water and Other Municipal Infrastructure and Services,3802,Waste Management,,Environmental Sustainability,Economic Growth,Capacity Development,,Urban Environmental Improvement,Developing urban areas,Institutional Development,,,,,
MDTF-WFPF,MDTF-WFPF,2013,8135,,46308-001,PHI,Design of a Pilot Project to Improve Environmental Conditions of Estero de Paco (Supplementary),MDTF-WFPF,,J,,,220, ,,,10/10/2013,,PHI,SERD,SEUW,Multidonor,S-CD,J,C,,3800,Water and Other Municipal Infrastructure and Services,3801,Water Supply and Sanitation,,Environmental Sustainability,,,,Urban Environmental Improvement,,,,,,,
MDTF-WFPF,MDTF-WFPF,2013,8154,,45207-001,BAN,Irrigation Management Improvement Investment Program,MDTF-WFPF,,,800,,275,29 Nov 2012,,,04/10/2013,11/29/2012,BAN,SARD,SAER,Multidonor,PP,,C,,3000,Agriculture and Natural Resources,3011,"Irrigation, Drainage, and Flood Protection",,Economic Growth,Social Development,Capacity Development,Private Sector Development,Widening Access To Markets and Economic Opportunities,Disaster Risk Management,Institutional Development,Public Private Partnerships,,,,
MDTF-WFPF,MDTF-WFPF,2013,8166,,44429-012,IND,Climate Adaptation through Sub-Basin Development Investment program,MDTF-WFPF,,J,,,321,25 Oct 2013,,,11/22/2013,10/25/2013,IND,SARD,SAER,Multidonor,PP,J,C,,3000,Agriculture and Natural Resources,3011,"Irrigation, Drainage, and Flood Protection",,,,,,,,,,,,,
MDTF-WFPF,MDTF-WFPF,2013,8201,,46080-001,PRC,Jiangxi Zhelin Lake Water Resources Integrated Utilization,MDTF-WFPF,,J,750,,290,25 Oct 2013,,,11/26/2013,10/25/2013,PRC,EARD,EAER,Multidonor,PP,J,C,,3900,Multisector,3900,Multisector,,Social Development,Economic Growth,Environmental Sustainability,Capacity Development,Human Development,Promoting Economic Efficiency and Enabling Business environment,Natural Resources Conservation,Institutional Development,,,,
MDTF-WFPF,MDTF-WFPF,2013,8303,,46049-001,PRC,Xinjiang Akesu Integrated Urban Development and Environment Improvement (Supplementary),MDTF-WFPF,,J,625,,250,26 Apr 2013,,,06/19/2013,04/26/2013,PRC,EARD,EASS,Multidonor,PP,J,C,,3900,Multisector,3900,Multisector,,Environmental Sustainability,,,,,,,,,,,
MDTF-WFPF,MDTF-WFPF,2013,8314,,46474-001,REG,Green Cities: A Sustainable Urban Future in Southeast Asia (Supplementary),MDTF-WFPF,,J,720,,150, ,,,10/30/2013,,REG,SERD,SEUW,Multidonor,R-CD,J,C,,3900,Multisector,3900,Multisector,,Environmental Sustainability,Economic Growth,Social Development,Capacity Development,Urban Environmental Improvement,"Knowledge,Science,And Technological Capacities",Disaster Risk Management,Institutional Development,,,,
MDTF-WFPF,MDTF-WFPF,2013,8339,,39295-032,BAN,Third Urban Governance and Infrastructure Improvement (Sector),MDTF-WFPF,,,1000,,450,27 Feb 2013,,,03/15/2013,02/27/2013,BAN,SARD,SAUW,Multidonor,PP,,C,,3800,Water and Other Municipal Infrastructure and Services,3801,Water Supply and Sanitation,,,,,,,,,,,,,
MDTF-WFPF,MDTF-WFPF,2013,8346,,35173-012,NEP,Third Small Towns Water Supply and Sanitation Sector,MDTF-WFPF,,J,800,,300,27 Feb 2013,,,04/05/2013,02/27/2013,NEP,SARD,SAUW,Multidonor,PP,J,C,,3800,Water and Other Municipal Infrastructure and Services,3801,Water Supply and Sanitation,,,,,,,,,,,,,
MDTF-WFPF,MDTF-WFPF,2013,8382,,47173-001,REG,Sustainable Hydropower in Asia Publication,MDTF-WFPF,,,,,112.5,26 Apr 2013,,,05/28/2013,04/26/2013,REG,SDCC,SDES,Multidonor,S-CD,,C,,3200,Energy,3202,Large Hydropower,,,,,,,,,,,,,
MDTF-WFPF,MDTF-WFPF,2013,8415,,47176-001,IND,Delhi Water Supply Improvement Investment Program,MDTF-WFPF,,J,800,,500,01 Jul 2013,,,07/29/2013,07/01/2013,IND,SARD,SAUW,Multidonor,PP,J,C,,3800,Water and Other Municipal Infrastructure and Services,3801,Water Supply and Sanitation,,Environmental Sustainability,Private Sector Development,Capacity Development,,Urban Environmental Improvement,,Institutional Development,,,,,
MDTF-WFPF,MDTF-WFPF,2013,8417,,47046-001,PRC,Gansu Featured Agriculture and Financial Services System Development,MDTF-WFPF,,J,700,,180,01 Jul 2013,,,08/05/2013,07/01/2013,PRC,EARD,EAER,Multidonor,PP,J,C,,3900,Multisector,3900,Multisector,,Economic Growth,Private Sector Development,,,"Promoting Economic Efficiency and Enabling Business environment,Widening Access To Markets and Economic Opportunities",Private Sector Investment,,,,,,
MDTF-WFPF,MDTF-WFPF,2013,8421,,47044-001,PRC,Eco-Compensation Mechanism and Policy Framework Study for the Xiangjiang River Watershed of the Chang-Zhu-Tan City Cluster,MDTF-WFPF,,J,400,,225,01 Jul 2013,,,08/05/2013,07/01/2013,PRC,EARD,EAER,Multidonor,PA,J,C,,3000,Agriculture and Natural Resources,3012,Land-Based Natural Resources Management,,Environmental Sustainability,,,,"Natural Resources Conservation,Urban Environmental Improvement,Environmental Policy And Legislation",,,,,,,
MDTF-WFPF,MDTF-WFPF,2013,8423,,47047-001,PRC,Shandong Groundwater Allocation and Protection,MDTF-WFPF,,J,600,,250,01 Jul 2013,,,08/09/2013,07/01/2013,PRC,EARD,EAER,Multidonor,PP,J,C,,3000,Agriculture and Natural Resources,3013,Water-Based Natural Resources Management,,Environmental Sustainability,,,,"Natural Resources Conservation,Environmental Policy And Legislation",,,,,,,
MDTF-WFPF,MDTF-WFPF,2013,8424,,47048-001,PRC,Hubei Enshi Qing River Upstream Environment Rehabilitation,MDTF-WFPF,,,600,,200,01 Jul 2013,,,08/09/2013,07/01/2013,PRC,EARD,EAER,Multidonor,PP,,C,,3900,Multisector,3900,Multisector,,,,,,,,,,,,,
MDTF-WFPF,MDTF-WFPF,2013,8445,,46088-001,PRC,Policy and Management System Development for Rural Environmental Protection,MDTF-WFPF,,J,450,,100,27 Aug 2013,,,09/11/2013,08/27/2013,PRC,EARD,EAER,Multidonor,PA,J,C,,3000,Agriculture and Natural Resources,3013,Water-Based Natural Resources Management,,Environmental Sustainability,Governance,Capacity Development,,"Natural Resources Conservation,Environmental Policy And Legislation","Public Administration (National,Decentralized,Regional),Civil Society Participation","Institutional Development,Organizational Development",,,,,
MDTF-WFPF,MDTF-WFPF,2013,8451,,47030-001,PRC,Jiangxi Pingxiang Integrated Rural-Urban Infrastructure Development,MDTF-WFPF,,J,600,,240,27 Aug 2013,,,09/18/2013,08/27/2013,PRC,EARD,EASS,Multidonor,PP,J,C,,3800,Water and Other Municipal Infrastructure and Services,3801,Water Supply and Sanitation,,Environmental Sustainability,Social Development,Capacity Development,,"Natural Resources Conservation,Urban Environmental Improvement",Disaster Risk Management,Institutional Development,,,,,
MDTF-WFPF,MDTF-WFPF,2013,8453,,44309-012,SRI,Trincomalee Integrated Urban Development,MDTF-WFPF,,E,,,500, ,,,09/20/2013,,SRI,SARD,SAUW,Multidonor,PP,E,C,,3800,Water and Other Municipal Infrastructure and Services,3813,Urban Sector Development,,Economic Growth,Environmental Sustainability,Private Sector Development,Capacity Development,Promoting Economic Efficiency and Enabling Business environment,Urban Environmental Improvement,Policy reforms,Institutional Development,,,,
MDTF-WFPF,MDTF-WFPF,2013,8457,,47904-01,PRC,Wastewater Treatment and Reuse,MDTF-WFPF,,J,,,250, ,,,09/20/2013,,PRC,PSOD,PSIF2,Multidonor,CD,J,C,,3800,Water and Other Municipal Infrastructure and Services,3802,Waste Management,,Environmental Sustainability,Economic Growth,,,Urban Environmental Improvement,Widening Access To Markets and Economic Opportunities,,,,,,
MDTF-WFPF,MDTF-WFPF,2013,8472,,47127-001,MYA,Mandalay City Urban Services Improvement,MDTF-WFPF,,J,1000,,500, ,,,10/03/2013,,MYA,SERD,SEUW,Multidonor,PP,J,C,,3800,Water and Other Municipal Infrastructure and Services,3813,Urban Sector Development,,Environmental Sustainability,Economic Growth,Capacity Development,,Urban Environmental Improvement,Promoting Economic Efficiency and Enabling Business environment,Institutional Development,,,,,
MDTF-WFPF,MDTF-WFPF,2013,8479,,43029-013,PRC,Restoration of Wetlands in Dalai Lake Nature Reserve of Inner Mongolia,MDTF-WFPF,,E,,,500,27 Feb 2013,,,10/08/2013,02/27/2013,PRC,EARD,EATC,Multidonor,CD,E,C,,3700,Transport and ICT,3701,Road Transport,,Economic Growth,Environmental Sustainability,Regional Cooperation and Integration,Capacity Development,"Promoting Economic Efficiency and Enabling Business environment,Widening Access To Markets and Economic Opportunities",Natural Resources Conservation,Trade and Investments,Institutional Development,,,,
MDTF-WFPF,MDTF-WFPF,2013,8491,,46078-002,PRC,Strengthening Urban Flood Management in Huainan Municipality,MDTF-WFPF,,E,,,500, ,,,10/25/2013,,PRC,EARD,EAER,Multidonor,PA,E,C,,3000,Agriculture and Natural Resources,3013,Water-Based Natural Resources Management,,Environmental Sustainability,Economic Growth,,,"Natural Resources Conservation,Urban Environmental Improvement",Promoting Economic Efficiency and Enabling Business environment,,,,,,
MDTF-WFPF,MDTF-WFPF,2013,8500,,43448-012,NEP,Institutional and Legal Support for Improved Water Management Systems in Nepal and Formation of the Bagmati River Basin Organization,MDTF-WFPF,,E,,,500,27 Aug 2013,,,10/31/2013,08/27/2013,NEP,SARD,SAER,Multidonor,PA,E,C,,3000,Agriculture and Natural Resources,3013,Water-Based Natural Resources Management,,Environmental Sustainability,Economic Growth,Social Development,Capacity Development,"Natural Resources Conservation,Urban Environmental Improvement","Promoting Economic Efficiency and Enabling Business environment,Widening Access To Markets and Economic Opportunities",Disaster Risk Management,"Institutional Development,Organizational Development",,,,
MDTF-WFPF,MDTF-WFPF,2013,8526,,47237-001,FIJ,Urban Development Planning and Institutional Capacity Building,MDTF-WFPF,,J,800,,350,25 Oct 2013,,,12/04/2013,10/25/2013,FIJ,PARD,PAUS,Multidonor,CD,J,C,,3800,Water and Other Municipal Infrastructure and Services,3813,Urban Sector Development,,Environmental Sustainability,Capacity Development,,,Urban Environmental Improvement,Institutional Development,,,,,,
MDTF-WFPF,MDTF-WFPF,2013,8541,,47075-001,PRC,Strengthening Capacity for Wetland Protection for Sanjiang Plain,MDTF-WFPF,,J,200,,300,25 Oct 2013,,,12/05/2013,10/25/2013,PRC,EARD,EAER,Multidonor,CD,J,C,,3000,Agriculture and Natural Resources,3013,Water-Based Natural Resources Management,,Environmental Sustainability,Capacity Development,,,"Natural Resources Conservation,Global And Regional Transboundary Environmental Issues",Institutional Development,,,,,,
